{
  "schema_version": 1,
  "artifact_type": "review_lane_draft",
  "generated_at_utc": "2026-05-11T00:00:00Z",
  "producer": {
    "name": "native-scherzo-agent",
    "version": "1",
    "mode": "extension-schema-smoke"
  },
  "lane": {
    "id": "security-performance",
    "name": "Security / performance risk reviewer",
    "category": "security-performance",
    "version": "1"
  },
  "input_refs": [],
  "draft_findings": [],
  "review_notes": [],
  "evidence_requests": [],
  "self_check": {
    "checked_no_remote_mutations": true,
    "notes": "Smoke fixture with no findings for security-performance."
  },
  "remote_mutations": "none"
}
